{
  "$schema": "https://json-schema.org/draft/2020-12/schema",
  "title": "Language values of a card",
  "description": "A file in data/language/card/, such as data/language/card/li/lightning-bolt/en.json. The name, type line, rules text, and flavor text of one card as one language prints them. The type line keeps its supertypes, card types, and subtypes, and the rules text keeps one entry per ability.",
  "type": "object",
  "additionalProperties": false,
  "required": ["lang", "card_id", "name"],
  "properties": {
    "card_id": {
      "type": "string",
      "pattern": "^[a-z0-9_-]+$"
    },
    "lang": {
      "type": "string",
      "description": "The language of these values, such as ja."
    },
    "name": {
      "type": "string",
      "description": "The card name as printed in this language."
    },
    "type_line": {
      "$ref": "#/$defs/type_line"
    },
    "rules_text": {
      "$ref": "#/$defs/rules_text"
    },
    "flavor_text": {
      "type": "string",
      "description": "The flavor text as printed in this language."
    },
    "history": {
      "type": "array",
      "description": "Records of official corrections to these values. Appended only; past records are never rewritten.",
      "items": { "$ref": "../correction.schema.json" }
    }
  },
  "$defs": {
    "type_line": {
      "type": "object",
      "additionalProperties": false,
      "description": "The supertypes, card types, and subtypes as this language prints them.",
      "properties": {
        "supertypes": {
          "type": "array",
          "minItems": 1,
          "items": { "type": "string" }
        },
        "card_types": {
          "type": "array",
          "minItems": 1,
          "items": { "type": "string" }
        },
        "subtypes": {
          "type": "array",
          "minItems": 1,
          "items": { "type": "string" }
        }
      }
    },
    "rules_text": {
      "type": "object",
      "additionalProperties": false,
      "description": "The rules text as this language prints it, one entry per ability of the card.",
      "required": ["abilities"],
      "properties": {
        "abilities": {
          "type": "array",
          "minItems": 1,
          "items": {
            "type": "object",
            "additionalProperties": false,
            "required": ["ability_id", "text"],
            "properties": {
              "ability_id": {
                "type": "string",
                "pattern": "^[a-z0-9][a-z0-9_-]*$",
                "description": "The ability_id of the ability this text belongs to in the card."
              },
              "text": {
                "type": "string",
                "description": "The rules text of that ability as printed in this language."
              }
            }
          }
        }
      }
    }
  }
}
