{
  "lang": "en",
  "card_id": "chandra-nalaar",
  "name": "Chandra Nalaar",
  "type_line": {
    "card_types": [
      "Planeswalker"
    ],
    "subtypes": [
      "Chandra"
    ]
  },
  "rules_text": {
    "abilities": [
      {
        "ability_id": "spark",
        "text": "+1: Chandra Nalaar deals 1 damage to target player or planeswalker."
      },
      {
        "ability_id": "blaze",
        "text": "−X: Chandra Nalaar deals X damage to target creature."
      },
      {
        "ability_id": "inferno",
        "text": "−8: Chandra Nalaar deals 10 damage to target player or planeswalker and each creature that player or that planeswalker's controller controls."
      }
    ]
  }
}
