{
  "lang": "en",
  "card_id": "lightning-bolt",
  "name": "Lightning Bolt",
  "type_line": {
    "card_types": [
      "instant"
    ]
  },
  "rules_text": {
    "abilities": [
      {
        "ability_id": "spell",
        "text": "Lightning Bolt deals 3 damage to any target."
      }
    ]
  }
}
