{
  "lang": "en",
  "card_id": "marionette-apprentice",
  "name": "Marionette Apprentice",
  "type_line": {
    "card_types": [
      "creature"
    ],
    "subtypes": [
      "creature_human",
      "creature_artificer"
    ]
  },
  "rules_text": {
    "abilities": [
      {
        "ability_id": "fabricate",
        "text": "Fabricate 1 (When this creature enters, put a +1/+1 counter on it or create a 1/1 colorless Servo artifact creature token.)"
      },
      {
        "ability_id": "drain",
        "text": "Whenever another creature or artifact you control is put into a graveyard from the battlefield, each opponent loses 1 life."
      }
    ]
  }
}
