{
  "lang": "ja",
  "card_id": "marionette-apprentice",
  "name": "マリオネットの見習い",
  "type_line": {
    "card_types": [
      "クリーチャー"
    ],
    "subtypes": [
      "人間",
      "工匠"
    ]
  },
  "rules_text": {
    "abilities": [
      {
        "ability_id": "fabricate",
        "text": "製造１（このクリーチャーが戦場に出たとき、これの上に＋１/＋１カウンター１個を置くか、無色の１/１の霊気装置・アーティファクト・クリーチャー・トークン１体を生成する。）"
      },
      {
        "ability_id": "drain",
        "text": "あなたがコントロールしていてクリーチャーやアーティファクトでありこれでない１つが戦場から墓地に置かれるたび、各対戦相手はそれぞれ１点のライフを失う。"
      }
    ]
  },
  "history": [
    {
      "path": "/rules_text/abilities",
      "was": [
        {
          "ability_id": "fabricate",
          "text": "製造１（このクリーチャーが戦場に出たとき、これの上に＋１/＋１カウンター１個を置くか、無色の１/１の霊気装置・アーティファクト・クリーチャー・トークン１体を生成する。）"
        },
        {
          "ability_id": "drain",
          "text": "あなたがコントロールしていてクリーチャーやアーティファクトでありこれでない１つが墓地から戦場に出るたび、各対戦相手はそれぞれ１点のライフを失う。"
        }
      ],
      "source": "https://mtg-jp.com/reading/information/0037890/",
      "corrected_at": "2024-06-05"
    }
  ]
}
